{
  "envelope_version": "2.0",
  "message_id": "01905e80-c0a0-7000-8000-000000000001",
  "thread_id": "01905e80-c0a0-7000-8000-000000000000",
  "parent_id": null,
  "from": {
    "eidolon": "human",
    "version": "n/a"
  },
  "to": {
    "eidolon": "atlas",
    "version": "1.12.1"
  },
  "performative": "REQUEST",
  "edge_origin": "roster",
  "objective": "Scout the codebase and hand off to SPECTRA for spec authoring, then to APIVR-Δ for implementation.",
  "artifact": {
    "kind": "prompt",
    "schema_version": "1.0",
    "path": "prompt.md",
    "sha256": "e3b0c44298fc1c149afbf4c8996fb92427ae41e4649b934ca495991b7852b855",
    "size_bytes": 0
  },
  "context_delta": {
    "token_budget": 4000,
    "tokens_used": 25,
    "input_handles": [],
    "summary": "Human initiates a full ATLAS→SPECTRA→APIVR-Δ TRANCE chain."
  },
  "constraints": {
    "trust_level": "standard"
  },
  "confidence": 1.0,
  "integrity": {
    "method": "sha256",
    "value": "e3b0c44298fc1c149afbf4c8996fb92427ae41e4649b934ca495991b7852b855"
  },
  "trace": {
    "ts": "2026-05-13T00:00:00Z",
    "host": "junction-example",
    "model": "n/a",
    "tier": "trance"
  }
}
